{
  "command": "check",
  "data": {
    "checks": [
      {
        "message": "/mnt/data does not exist",
        "name": "hidden-volume",
        "remediation": "If the volume is already prepared, unlock and mount it at /mnt/data, then run the command again.\nSetting up here would leave files on this computer's own disk, where an examination can find them.\nPrepare the volume where nothing reaches this disk: on an external drive prepared on another computer (recommended), or from a setup medium (a live system started from a USB stick).\nThen unlock and mount it here, and run the program from it.\nRead \"Where setup happens\" in the operator guide on another device: opening it here leaves traces such as ~/.lesshst.",
        "status": "fail"
      },
      {
        "message": "requires mounted hidden volume",
        "name": "backend-entries",
        "status": "skipped"
      },
      {
        "message": "on the plain decoy root",
        "name": "session-state",
        "status": "pass"
      },
      {
        "message": "Ubuntu 24.04",
        "name": "platform",
        "status": "pass"
      },
      {
        "message": "systemd 255 supports soft-reboot",
        "name": "systemd-version",
        "status": "pass"
      },
      {
        "message": "soft-reboot.target and systemd-soft-reboot.service are installed",
        "name": "soft-reboot-units",
        "status": "pass"
      },
      {
        "message": "the decoy root (ext4 on /dev/sda1) can be mounted again for the way back",
        "name": "decoy-root",
        "status": "pass"
      },
      {
        "message": "decoy filesystems in the hidden root: /boot/efi: read-only",
        "name": "fstab-policy",
        "status": "pass"
      },
      {
        "message": "Cannot read /proc/1/ns/mnt to compare against PID 1's mount namespace (Permission denied (os error 13)). Run activation as root from a host shell, not inside a container.",
        "name": "mount-namespace",
        "status": "fail"
      },
      {
        "message": "All 4 required host tools are present",
        "name": "host-tools",
        "status": "pass"
      },
      {
        "message": "The way back finds nft, and iw where a link is a Wi-Fi interface",
        "name": "network-tools",
        "status": "pass"
      },
      {
        "message": "requires mounted hidden volume",
        "name": "symlink-support",
        "status": "skipped"
      },
      {
        "message": "requires mounted hidden volume",
        "name": "upper-fs-capability",
        "status": "skipped"
      },
      {
        "message": "Backend detection skipped: the hidden root is not a mount point",
        "name": "backend-detect",
        "status": "pass"
      },
      {
        "message": "Skipping the VeraCrypt Argon2id advice: only a check running as root reads the installed cryptsetup version, from the package database, without updating its access time",
        "name": "cryptsetup-argon2id",
        "status": "pass"
      },
      {
        "message": "requires mounted hidden volume",
        "name": "storage-readiness",
        "status": "skipped"
      },
      {
        "message": "no swap can leak memory to persistent storage (RAM-only zram is permitted)",
        "name": "swap",
        "status": "pass"
      },
      {
        "message": "The decoy kernel does not zero freed memory: pages the hidden session frees keep their contents in RAM until something reuses them.\nAdd init_on_free=1 to the decoy kernel command line, and power off after a session rather than leaving the machine running.",
        "name": "memory-wipe",
        "status": "warn"
      },
      {
        "message": "The kernel is not remapping DMA through an IOMMU (the command line turns it off or into passthrough, /sys lists no active IOMMU, or every IOMMU group is identity-mapped), so any DMA-capable device \u2014 Thunderbolt or USB4, built-in PCIe, an NVMe/M.2 or ExpressCard slot \u2014 can map and read all of system RAM over the bus.\nNAILS cannot turn DMA protection on for you: it lives in firmware \u2014 enable VT-d or AMD-Vi and \"Kernel DMA Protection\" in BIOS/UEFI setup, and, if the kernel still does not remap DMA, add the IOMMU flag to the decoy kernel command line and reboot. Those are NVRAM and boot-configuration changes NAILS refuses to make on your behalf, the same boundary that stops it setting the TCG Memory Overwrite Request (MOR) bit. No IOMMU makes a machine left powered on and unlocked safe against seizure, because a DMA peripheral reads RAM straight off the bus without the CPU; power off (`sudo /opt/nails/nails emergency --poweroff`) before the machine leaves your control.",
        "name": "dma-protection",
        "status": "warn"
      },
      {
        "message": "the host would suspend an active session: closing the lid suspends the host (HandleLidSwitch=suspend). A suspend leaves the hidden session resident in RAM behind the hidden session's own lock screen. Set the logind lid switch to lock (see docs/decoy-requirements.md), or set sleep_policy.mode = \"block\" or \"teardown\" in nails.toml.",
        "name": "sleep-policy",
        "status": "warn"
      },
      {
        "message": "decoy keeps a persistent record of the hidden session: systemd-journald keeps a persistent journal on the decoy disk (/var/log/journal); set Storage=volatile under [Journal] in /etc/systemd/journald.conf or in a drop-in such as /etc/systemd/journald.conf.d/50-volatile.conf (drop-ins override the main file); rsyslog is active and writes logs to the decoy disk.",
        "name": "decoy-persistence",
        "remediation": "Make the decoy amnesic (Storage=volatile for journald, set in journald.conf or a journald.conf.d/*.conf drop-in; no active syslog or audit daemon, such as rsyslog, syslog-ng, a syslogd or auditd), or pass --allow-persistent-decoy to allow the risk for this run. See docs/decoy-requirements.md.",
        "status": "fail"
      },
      {
        "message": "no pending offline update is staged on the decoy",
        "name": "pending-offline-update",
        "status": "pass"
      },
      {
        "message": "requires mounted hidden volume",
        "name": "kernel-modules",
        "status": "skipped"
      },
      {
        "message": "no warned residue channel is live (6 catalog probes); noted: timesync-clock (/var/lib/systemd/timesync/clock): Session touches land in the upper; on a persistent decoy, use the decoy normally after a session so its own activity follows the stamp. (see docs/decoy-requirements.md#session-time-records); timer-stamps (/var/lib/systemd/timers): Session stamps land in the upper; expect catch-up runs at the next decoy boot. (see docs/decoy-requirements.md#session-time-records)",
        "name": "residue-catalog",
        "status": "pass"
      },
      {
        "message": "requires mounted hidden volume",
        "name": "space",
        "status": "skipped"
      },
      {
        "message": "the running binary /opt/nails/nails is not under the hidden volume root /mnt/data; a copy on the decoy disk is a forensic artifact",
        "name": "binary-location",
        "status": "warn"
      },
      {
        "message": "Target user could not be resolved; inherited decoy state was not inspected",
        "name": "inherited-autostart",
        "status": "pass"
      },
      {
        "message": "Target user could not be resolved; shell history-flush settings were not inspected",
        "name": "incremental-history-flush",
        "status": "pass"
      },
      {
        "message": "System is inactive - ready for activation",
        "name": "state",
        "status": "pass"
      }
    ],
    "config": {
      "config_file": "/mnt/data/config/nails.toml",
      "hidden_volume_root": "/mnt/data",
      "log_path": "/mnt/data/logs",
      "minimum_space_mb": 500,
      "persona_mode": "shared-home",
      "state_file": "/mnt/data/state.json"
    },
    "filesystems": [
      "/boot/efi: read-only"
    ],
    "inherited": {
      "entries": [],
      "inspected": false,
      "remote_linked": [],
      "unmatched_masks": []
    },
    "profile": {
      "detail": null,
      "mode": "none"
    },
    "ready": false,
    "refusal": {
      "code": "not_separate_volume",
      "message": "/mnt/data does not exist. Nothing was written.\nIf the volume is already prepared, unlock and mount it at /mnt/data, then run the command again.\nSetting up here would leave files on this computer's own disk, where an examination can find them.\nPrepare the volume where nothing reaches this disk: on an external drive prepared on another computer (recommended), or from a setup medium (a live system started from a USB stick).\nThen unlock and mount it here, and run the program from it.\nRead \"Where setup happens\" in the operator guide on another device: opening it here leaves traces such as ~/.lesshst.",
      "next": null
    },
    "summary": {
      "failed": 3,
      "passed": 16,
      "skipped": 6,
      "warnings": 4
    }
  },
  "ok": false,
  "schema_version": 2
}
